id,post_id,author_id,body
1,229,19,Mollit voluptate fugiat incididunt magna nulla proident aliquip sint esse sit pariatur ipsum laboris.
2,133,2,Proident sunt commodo minim consequat qui est.
3,432,8,Eiusmod nostrud eiusmod cupidatat irure ullamco in aute in aliqua.
4,435,9,Eu labore veniam ea veniam ipsum enim id nisi cupidatat occaecat consectetur.
5,366,2,Laboris officia occaecat sint elit in consequat in anim enim amet dolore adipisicing quis.
6,68,31,Ex laboris nostrud amet irure enim ea amet voluptate ad irure amet.
7,14,25,Sunt adipisicing consequat sint culpa deserunt consequat cillum do Lorem deserunt.
8,431,8,Do dolor magna laborum est consectetur veniam ullamco et labore irure.
9,383,16,Nulla cillum occaecat tempor irure consequat enim sunt occaecat tempor commodo enim est eiusmod.
10,473,30,Do exercitation voluptate aliqua Lorem.
11,504,14,Consectetur cupidatat quis reprehenderit fugiat qui dolor occaecat voluptate enim.
12,388,21,Fugiat minim mollit et dolor commodo enim tempor aliquip.
13,451,23,Laborum cillum eu mollit mollit pariatur.
14,387,11,Adipisicing nostrud reprehenderit consectetur elit labore reprehenderit ut adipisicing voluptate incididunt.
15,141,12,Laborum culpa ipsum ullamco Lorem adipisicing nisi minim excepteur fugiat non veniam tempor.
16,67,17,Enim culpa mollit quis sit officia nulla.
17,450,2,Consectetur reprehenderit nulla mollit tempor sit esse.
18,219,26,Pariatur pariatur non anim tempor qui aliqua sunt voluptate eiusmod eiusmod.
19,268,21,Cillum velit ad officia mollit fugiat fugiat deserunt magna incididunt.
20,412,16,Consequat duis nostrud irure minim minim.
21,8,7,Consectetur do cupidatat ut velit.
22,116,18,Consequat elit aliqua tempor sunt incididunt dolor esse.
23,211,19,Deserunt magna esse laboris id dolor aute id sint officia aliquip amet aute.
24,257,3,Irure non sunt dolor sunt irure et officia minim fugiat magna eu.
25,216,5,In irure dolor dolore labore consectetur sit.
26,208,28,Est mollit quis sint occaecat reprehenderit exercitation officia.
27,321,31,Nisi reprehenderit proident nostrud dolore dolor fugiat id laboris ex adipisicing labore amet anim.
28,150,22,Quis ea est occaecat elit.
29,367,4,Deserunt cillum voluptate labore anim.
30,9,11,Occaecat deserunt et ex commodo.
31,276,10,Laborum Lorem cillum non sit ipsum.
32,430,2,Nulla sint officia ut occaecat ex magna adipisicing.
33,300,28,Anim elit eiusmod id elit est dolore eiusmod excepteur dolor nisi sunt.
34,418,10,Ipsum ea culpa eu aliqua sunt sint.
35,318,10,Dolore sit est consectetur ex consequat aute labore officia magna.
36,152,28,Veniam veniam occaecat aute qui quis in est.
37,255,8,Elit pariatur dolore laboris magna pariatur minim ad minim.
38,338,26,Exercitation proident officia aliquip eiusmod tempor et.
39,389,30,Elit veniam ipsum id ex eu eiusmod Lorem aliqua sit non anim consequat.
40,109,12,Dolore magna qui et labore consequat est do dolore ut.
41,413,31,Consequat aute pariatur tempor ut ullamco deserunt.
42,175,9,Reprehenderit elit ipsum excepteur adipisicing consequat non labore incididunt est tempor fugiat occaecat qui.
43,36,20,Reprehenderit id exercitation occaecat aliqua et dolor elit dolor aliquip dolor ullamco cupidatat eu amet.
44,125,21,Excepteur eu anim minim elit adipisicing laboris consequat ut.
45,350,32,Fugiat ipsum ad veniam eiusmod veniam ipsum.
46,107,12,Quis labore cillum pariatur dolor et magna sit qui.
47,498,17,Ullamco fugiat velit aliqua eu consequat.
48,284,30,Eiusmod ad officia et aliquip Lorem occaecat elit cillum.
49,322,22,Laborum eu dolor irure minim dolor esse officia minim eu minim exercitation cupidatat.
50,484,18,Nisi esse dolore adipisicing ut pariatur duis id cupidatat.
51,459,16,Consectetur tempor non exercitation anim occaecat reprehenderit duis nisi.
52,287,15,Pariatur minim adipisicing eiusmod aliqua.
53,296,26,Lorem nulla in aliqua exercitation sint esse.
54,104,25,Velit elit duis id fugiat mollit non ut adipisicing.
55,128,13,Velit cupidatat ex reprehenderit occaecat non laboris labore adipisicing.
56,155,20,Enim eiusmod dolor occaecat nulla officia exercitation consectetur irure sint.
57,336,16,Excepteur sunt minim sunt laborum ad dolore velit excepteur labore ut et eiusmod non in.
58,378,29,In ipsum et non proident commodo aute amet.
59,4,25,Minim velit est enim ullamco laboris Lorem in eiusmod ea duis id laborum sit incididunt.
60,282,5,Sit dolore ullamco mollit ad labore eu consequat deserunt nostrud tempor proident adipisicing.
61,428,2,Do proident est culpa minim excepteur nisi nostrud do ipsum amet ullamco incididunt.
62,104,12,Laborum amet deserunt ea cupidatat minim ut nulla consequat.
63,311,29,Officia do labore ut nostrud laborum dolore ipsum est labore dolore velit officia.
64,216,7,Aute ipsum commodo eiusmod nostrud commodo ullamco velit sunt id voluptate reprehenderit voluptate.
65,95,10,Minim irure laboris est consequat cupidatat pariatur.
66,208,25,Duis nostrud mollit et ea ipsum cillum ad quis pariatur quis tempor non ut velit.
67,359,30,Anim ullamco deserunt tempor eu labore labore deserunt duis tempor excepteur exercitation veniam et fugiat.
68,68,3,Excepteur sunt labore incididunt non nisi laborum elit esse ipsum elit.
69,320,31,Qui ut sit occaecat culpa minim do consectetur adipisicing non officia labore amet mollit.
70,126,19,Excepteur occaecat nostrud consectetur magna eiusmod do est qui minim ea adipisicing et laborum.
71,473,8,Qui aliqua aliquip sunt incididunt incididunt do.
72,479,23,Et laborum officia consectetur eu proident aute non.
73,109,26,Tempor amet voluptate ea qui ut reprehenderit aliquip irure et dolore excepteur cillum irure nostrud.
74,60,13,Velit et in amet elit cupidatat.
75,491,11,Sit quis cillum mollit irure.
76,474,11,Quis est nostrud non eiusmod magna cupidatat quis laborum nostrud est sunt aliquip adipisicing.
77,37,29,Excepteur aliqua do deserunt proident eu amet exercitation proident ad nostrud sunt sunt mollit.
78,384,30,Id excepteur amet sunt ullamco anim consequat proident ex sunt duis aute enim aliquip.
79,100,4,Ad labore occaecat velit proident cupidatat ullamco eu cupidatat.
80,244,27,Voluptate qui magna excepteur tempor cupidatat Lorem commodo magna duis veniam occaecat nulla aute adipisicing.
81,91,21,Eiusmod amet sit nulla deserunt commodo veniam sit amet anim nulla labore.
82,325,32,Ut magna do aliquip ex.
83,5,16,Laboris Lorem et dolor consequat nisi voluptate anim amet dolore pariatur culpa nostrud consectetur elit.
84,70,23,Laboris et sit ullamco qui consectetur est exercitation.
85,360,10,Aute nostrud aliquip ad id magna sit sunt.
86,49,8,Cillum cillum ut non labore ipsum mollit nisi ea consequat anim.
87,254,5,Ipsum id amet ad excepteur qui commodo fugiat veniam anim.
88,171,29,Cupidatat veniam in irure labore aliquip laborum fugiat non sunt non consectetur deserunt.
89,267,31,Id tempor magna irure sit nostrud occaecat.
90,327,10,Aliquip nisi ullamco non excepteur qui pariatur tempor pariatur.
91,419,16,Veniam laborum occaecat proident sunt ut esse dolore reprehenderit.
92,343,11,Irure duis adipisicing dolore non aliquip laborum.
93,284,12,Eiusmod quis consequat voluptate ex aute commodo esse dolore nulla sunt duis.
94,248,2,Laborum nostrud ut deserunt exercitation nulla enim mollit ullamco occaecat.
95,172,26,Deserunt nostrud excepteur exercitation in labore ut est ea anim irure Lorem.
96,89,17,Ullamco ullamco sit ullamco sunt minim duis magna adipisicing eu qui officia est ullamco.
97,461,17,Veniam dolore elit aliqua ut pariatur veniam nisi irure reprehenderit commodo.
98,37,22,Laborum voluptate sit tempor ad consectetur.
99,494,31,Fugiat Lorem ea consectetur sint nisi reprehenderit quis reprehenderit laborum incididunt anim qui.
100,86,19,Amet nostrud anim proident sit labore.
101,150,1,Consequat et officia do est.
102,211,2,Deserunt laboris esse quis incididunt consectetur laboris esse sint ut voluptate aliquip et eiusmod.
103,242,21,Pariatur exercitation magna enim exercitation non.
104,507,18,Quis adipisicing irure pariatur irure nisi laboris laboris.
105,404,29,Veniam anim deserunt irure dolor laboris aliqua veniam sint enim deserunt irure ea elit.
106,416,17,Occaecat excepteur voluptate ipsum duis do nisi labore eiusmod laboris consectetur.
107,110,19,Culpa cupidatat occaecat eu velit aliquip dolore cillum velit ex officia id proident cupidatat.
108,386,2,Do magna irure culpa aliquip magna elit exercitation fugiat nulla nulla in.
109,174,3,Aliquip tempor do consequat elit culpa ex fugiat quis.
110,138,28,Laborum amet excepteur est non sunt eiusmod qui sit aliquip ea sit quis ut.
111,11,26,Occaecat tempor velit voluptate dolore fugiat.
112,264,7,Ut aliqua deserunt eiusmod ea do irure.
113,317,6,Non cupidatat sunt cupidatat et exercitation elit anim et veniam.
114,179,29,Incididunt adipisicing non consequat cupidatat aliquip.
115,500,7,Aliqua exercitation ullamco commodo nisi ea ipsum fugiat.
116,54,8,In ea dolor enim aliqua.
117,505,16,Ex ut excepteur eiusmod aute consequat exercitation duis voluptate esse in.
118,380,4,Do reprehenderit esse fugiat eu ex deserunt anim irure ullamco ad occaecat.
119,198,14,Elit sint veniam minim ullamco ea proident ea fugiat duis Lorem.
120,421,18,Consequat Lorem ex cupidatat dolore ad duis sit dolore.
121,205,3,Nulla irure exercitation anim sit incididunt Lorem qui nulla incididunt labore nostrud labore reprehenderit aute.
122,52,28,Nulla culpa aute aliqua qui aliquip dolor non aliquip sint id commodo ex.
123,68,23,Irure sunt cillum elit elit dolor reprehenderit veniam laborum tempor Lorem laborum aliqua exercitation.
124,241,20,Minim occaecat excepteur amet et magna in.
125,142,15,Non consectetur officia do irure esse minim ad nisi aliqua incididunt non.
126,51,28,Eu quis magna non culpa aliqua officia.
127,460,15,Nostrud cupidatat eiusmod voluptate aliquip in ut duis.
128,242,2,Laborum consectetur esse anim ut excepteur esse exercitation pariatur ipsum magna reprehenderit excepteur aute excepteur.
129,366,12,Cupidatat reprehenderit pariatur elit tempor proident dolore cillum velit deserunt nisi amet.
130,190,17,Ipsum est enim ullamco laborum.
131,493,22,Veniam nisi proident et amet ut reprehenderit dolor dolor voluptate aliqua eiusmod in aliqua laboris.
132,94,9,Tempor aute ea veniam reprehenderit deserunt occaecat.
133,157,21,Eu veniam aute sint consequat aliqua mollit esse qui minim in pariatur deserunt cupidatat.
134,129,8,Sint ut irure occaecat esse excepteur.
135,390,19,Officia voluptate in amet laboris dolor cupidatat reprehenderit ex sunt voluptate culpa duis ullamco minim.
136,487,15,Esse esse elit amet ut non cupidatat eu cillum esse voluptate nostrud sunt enim.
137,386,21,Eu voluptate velit irure eiusmod proident ad cupidatat ut ea enim est magna commodo.
138,349,25,Dolor elit elit anim exercitation magna consequat nisi laboris dolore voluptate.
139,256,1,Sint minim in dolore tempor eiusmod.
140,322,7,Aute aliqua commodo enim anim occaecat fugiat occaecat id laborum do est magna ad.
141,172,6,Esse laborum dolore aliqua duis et ut anim commodo consectetur nisi nisi amet dolor.
142,17,26,Laborum enim est exercitation est.
143,461,18,Consectetur adipisicing ut elit deserunt dolore laborum.
144,1,21,Qui sint in aliqua quis sunt.
145,264,4,Veniam exercitation reprehenderit fugiat tempor ex et ad mollit minim.
146,118,19,Anim nostrud commodo sint nulla officia deserunt dolor.
147,462,19,Laboris cupidatat qui amet culpa non.
148,204,18,Deserunt dolor nostrud velit amet ut cupidatat ullamco elit.
149,51,21,Aliquip labore excepteur laborum ut.
150,167,9,Dolore qui velit laboris magna et reprehenderit aliquip adipisicing in incididunt voluptate reprehenderit id.
151,212,9,Incididunt sit irure pariatur ullamco proident nisi est aliqua laboris laborum aliqua non aute.
152,156,27,Lorem ea ut velit veniam nulla cupidatat eiusmod.
153,399,29,Sint sint excepteur deserunt Lorem adipisicing sint aute.
154,262,3,Quis proident velit consectetur consequat nisi pariatur veniam nostrud.
155,19,7,Do duis deserunt fugiat Lorem ipsum nisi ipsum ea sint.
156,304,9,Commodo sint ea Lorem ullamco esse ipsum tempor elit proident amet elit.
157,81,4,Non eu mollit culpa mollit.
158,153,8,Quis consectetur officia et deserunt do mollit id.
159,53,23,Magna eiusmod eu amet occaecat minim reprehenderit incididunt reprehenderit tempor tempor dolore id.
160,170,13,Laboris id mollit duis sint exercitation ea proident.
161,307,24,Excepteur ea non elit est incididunt sit velit dolore do amet.
162,165,21,Magna magna labore tempor labore mollit Lorem esse fugiat laborum cillum proident nisi.
163,412,21,Duis id sint aliqua ea voluptate aliqua sunt elit.
164,489,17,Deserunt excepteur deserunt aliquip proident.
165,100,26,Proident qui incididunt tempor nulla.
166,427,19,Nulla reprehenderit magna ut id nulla culpa consectetur exercitation dolore.
167,237,32,Occaecat elit tempor velit duis deserunt irure voluptate tempor fugiat.
168,190,18,Ipsum sunt aliquip ea excepteur eu in sunt id aute esse sint elit irure elit.
169,428,28,Esse dolor est minim quis eu id cillum dolore aliqua ex anim et irure irure.
170,218,32,Cillum proident voluptate et dolor in nostrud officia ipsum ex voluptate culpa ipsum eiusmod tempor.
171,28,26,Minim Lorem qui nulla nisi esse Lorem elit qui.
172,242,20,Occaecat aliquip labore deserunt esse mollit ipsum ex dolore in.
173,49,5,Occaecat excepteur mollit eu id sit officia esse minim reprehenderit officia eiusmod.
174,207,3,Ut laborum labore et cupidatat excepteur dolor proident do.
175,92,28,Est incididunt ut incididunt qui eiusmod sunt nisi sunt deserunt ad ipsum velit laborum minim.
176,305,15,In officia voluptate minim est reprehenderit consequat quis.
177,204,21,Ea Lorem deserunt elit sunt tempor esse dolore irure amet ea minim mollit.
178,287,25,Proident irure et voluptate esse est aliqua eiusmod aute esse occaecat qui aliqua adipisicing reprehenderit.
179,191,13,Proident Lorem incididunt esse deserunt cupidatat ex.
180,391,25,Excepteur est quis aute quis pariatur cillum consectetur aliqua.
181,466,31,Exercitation sit ullamco in sint ea occaecat minim anim enim qui minim.
182,165,25,Cupidatat ad deserunt laborum sunt non magna amet anim proident dolore.
183,53,12,Fugiat irure enim fugiat mollit ea sint.
184,9,32,Aliquip minim ex mollit ipsum irure minim consequat cupidatat sit.
185,388,7,Incididunt nulla minim reprehenderit incididunt cillum aliquip qui eiusmod in aute quis ad minim.
186,290,27,Do esse anim laboris voluptate sit aute mollit tempor ea ea esse ex voluptate.
187,57,26,Do qui ex duis eu amet magna minim anim non adipisicing ad laboris.
188,48,19,Eu sunt nisi tempor et laboris laborum magna aute.
189,227,7,Minim sint nisi officia tempor sunt reprehenderit ullamco consectetur.
190,203,7,Adipisicing adipisicing qui ut irure sunt mollit eu culpa eu officia magna incididunt elit.
191,293,9,Reprehenderit ipsum irure qui officia officia.
192,471,7,Nulla cillum cupidatat occaecat exercitation excepteur.
193,222,30,Reprehenderit magna qui sunt elit labore nostrud dolore quis eiusmod veniam cillum.
194,385,7,Labore excepteur aute dolor duis aliqua aute velit ex.
195,297,28,Deserunt culpa eiusmod exercitation irure minim ea sunt voluptate enim occaecat magna minim duis non.
196,179,21,Irure ad sint mollit velit in.
197,86,1,Velit amet sunt nulla esse ea.
198,235,16,Nisi amet veniam consectetur proident nisi.
199,477,25,Ullamco fugiat elit deserunt esse veniam.
200,404,8,Mollit aliquip sint eiusmod fugiat laborum est exercitation.
201,124,26,Dolor dolor laborum eu eiusmod ex reprehenderit velit deserunt.
202,438,5,Pariatur consectetur sunt fugiat cupidatat dolor commodo irure ut Lorem non exercitation consequat.
203,104,3,In eiusmod et ex mollit tempor magna deserunt qui reprehenderit do occaecat.
204,431,3,Et dolor nulla Lorem nostrud laborum nisi aute velit labore minim eiusmod incididunt.
205,154,20,Ex eiusmod commodo deserunt officia.
206,280,10,Ullamco ex laborum do sint ex ex Lorem mollit nulla cillum.
207,193,20,Sint occaecat esse minim laborum voluptate ea aute irure.
208,368,25,Consectetur id culpa labore laborum aliqua laborum veniam.
209,295,17,Labore officia ipsum ut commodo aute exercitation aliqua exercitation.
210,322,15,Officia elit sit amet dolore ipsum.
211,430,20,Magna tempor officia voluptate veniam.
212,505,16,Eiusmod voluptate nulla cupidatat incididunt commodo nulla labore occaecat deserunt labore incididunt.
213,291,1,Ullamco et magna enim incididunt laboris.
214,118,1,Labore nisi Lorem duis consequat aliquip in eiusmod esse voluptate velit adipisicing culpa.
215,78,28,Consectetur mollit fugiat excepteur duis excepteur sunt sit voluptate sunt veniam do sint.
216,13,32,Fugiat reprehenderit culpa sit ex laboris nostrud eu in.
217,69,23,Eu eiusmod et consectetur dolore consectetur nisi id anim elit cupidatat.
218,443,1,Laborum mollit elit aliqua ipsum pariatur ea cillum reprehenderit.
219,510,8,Magna quis laboris deserunt ullamco quis.
220,70,5,Exercitation est esse ad do ipsum velit pariatur consectetur anim do est.
221,269,12,Amet do dolor fugiat non ullamco excepteur.
222,504,3,Anim cillum quis dolore sint veniam sunt et eu quis duis.
223,414,29,Ullamco nisi elit commodo qui reprehenderit enim labore.
224,22,27,Mollit adipisicing ullamco deserunt occaecat quis anim consectetur cillum dolor minim.
225,244,14,Officia velit proident irure commodo quis ullamco sint do quis qui.
226,157,26,Nostrud labore eiusmod mollit velit.
227,192,26,Cupidatat cupidatat magna aute velit qui cillum voluptate.
228,429,16,Nostrud Lorem esse non dolor adipisicing dolor dolore sint consectetur ex.
229,342,32,Adipisicing occaecat exercitation ex fugiat eiusmod deserunt adipisicing officia adipisicing eiusmod pariatur minim non tempor.
230,295,8,Culpa velit laboris do cupidatat amet ea consectetur Lorem eu reprehenderit aliqua.
231,468,30,Fugiat cupidatat non ea incididunt sint fugiat minim sit.
232,350,10,Incididunt quis elit quis nostrud do fugiat ad nostrud duis.
233,395,2,Voluptate eiusmod sint velit cillum nisi exercitation irure duis anim ullamco amet.
234,331,6,Ut exercitation do ullamco elit ex proident est ipsum exercitation deserunt exercitation ad elit fugiat.
235,128,9,Occaecat velit ullamco duis in deserunt occaecat ea.
236,453,24,Voluptate pariatur esse sint reprehenderit ex quis id qui reprehenderit ea Lorem commodo.
237,129,12,Duis aliquip deserunt est adipisicing.
238,329,31,Qui ex eu incididunt consectetur voluptate nostrud aliquip pariatur cupidatat ea officia sint Lorem.
239,66,16,In reprehenderit minim adipisicing deserunt culpa cupidatat ut ex reprehenderit esse culpa fugiat consectetur.
240,423,25,Elit in et labore mollit sunt dolor et veniam adipisicing reprehenderit ullamco nulla nostrud nisi.
241,31,2,Do irure ipsum ea cillum.
242,269,20,Cupidatat ipsum ad laboris cillum consequat laboris ad est cillum consectetur.
243,391,7,Officia labore magna et esse qui.
244,113,28,Esse ad non velit culpa ea eu ex deserunt eu amet id.
245,159,17,Aliqua amet nostrud commodo labore anim elit mollit duis quis nostrud.
246,384,15,Velit reprehenderit aute adipisicing eiusmod non.
247,61,13,Ex irure pariatur anim tempor anim ipsum consequat labore dolore nisi sit excepteur laboris.
248,305,3,Fugiat labore Lorem ipsum officia ut.
249,477,9,Voluptate elit culpa ipsum cillum reprehenderit dolore et ullamco et ex aute enim irure.
250,344,29,Ut eiusmod adipisicing esse occaecat consectetur consectetur.
251,472,30,Occaecat officia enim magna sit id fugiat.
252,416,1,Occaecat voluptate nulla cillum aliqua consectetur elit quis ullamco consectetur.
253,398,29,Sit cupidatat laborum aliquip ex non.
254,279,23,Voluptate mollit excepteur elit deserunt est commodo.
255,257,2,Esse sit dolore ut aliquip sint.
256,191,3,Voluptate pariatur occaecat officia mollit sunt anim esse id.
257,139,6,Sint amet ea pariatur excepteur mollit fugiat sint non fugiat ad laboris laboris fugiat.
258,192,26,Magna labore mollit ullamco dolore nisi consectetur eiusmod ullamco eiusmod reprehenderit do laboris.
259,453,29,Excepteur ad cupidatat esse nostrud sint sint.
260,207,16,Deserunt duis laboris aliquip amet labore velit consectetur mollit enim nostrud.
261,99,7,Tempor consequat nulla do proident nulla commodo duis aliquip eiusmod esse occaecat.
262,433,14,Officia eiusmod incididunt mollit consectetur culpa aliqua sint laboris irure.
263,410,27,Dolor ex occaecat pariatur pariatur sunt eiusmod cillum nulla reprehenderit ea.
264,229,9,Cillum ipsum ipsum enim reprehenderit anim exercitation nisi adipisicing.
265,416,22,Esse nulla non exercitation sint consectetur ex ullamco incididunt nisi laboris ea sunt.
266,246,20,Commodo esse quis id mollit commodo cillum enim qui adipisicing anim sint dolore elit aliqua.
267,442,13,Qui consequat amet fugiat labore fugiat laborum nisi pariatur.
268,103,32,Labore veniam aliqua dolore ex aliqua excepteur dolor.
269,213,10,Deserunt nostrud labore Lorem exercitation mollit ea in do quis voluptate excepteur.
270,198,2,Velit magna elit veniam ipsum fugiat ullamco dolore voluptate ipsum non officia exercitation deserunt.
271,231,9,Voluptate proident exercitation Lorem culpa adipisicing voluptate laboris cupidatat amet sit amet.
272,20,27,Ullamco et esse fugiat magna pariatur.
273,409,8,Velit do tempor commodo aliqua occaecat mollit tempor.
274,144,16,Excepteur minim voluptate quis non eu eu deserunt et.
275,325,6,Exercitation dolor qui deserunt Lorem.
276,241,18,Amet id sint esse in esse cillum ipsum.
277,465,22,Eiusmod in laboris dolore elit eu culpa esse consequat non ut.
278,165,17,Ex proident Lorem consequat non nisi aliquip nulla.
279,183,11,Culpa nulla consectetur sunt et labore sint in.
280,269,8,Culpa ut nulla pariatur adipisicing do nisi qui ea.
281,280,13,Incididunt aliqua velit veniam ut culpa sunt aliquip.
282,239,21,Minim do ipsum laboris adipisicing est cupidatat do eu qui aute culpa amet esse occaecat.
283,457,31,Officia et magna minim qui fugiat pariatur amet eu enim.
284,40,27,Minim ex minim anim quis.
285,5,23,Non occaecat aute eu anim amet laboris mollit dolore nulla velit aliquip anim.
286,408,24,Quis mollit anim dolore duis adipisicing magna excepteur aliquip id id veniam nostrud dolore.
287,464,4,Proident nostrud adipisicing id sit ea labore cupidatat magna do exercitation officia pariatur excepteur ad.
288,219,24,Magna in elit eiusmod nisi aliqua.
289,434,15,Eu cupidatat est magna reprehenderit ullamco velit reprehenderit sint enim.
290,99,4,Mollit sit reprehenderit eu culpa pariatur velit Lorem esse sint.
291,176,17,Qui elit laboris irure cupidatat in incididunt nisi minim sint qui.
292,300,29,Aliqua adipisicing esse duis aute in.
293,71,23,Reprehenderit reprehenderit ut irure excepteur labore dolore sit occaecat ad minim qui non.
294,289,21,Laborum deserunt minim aliquip laborum pariatur incididunt occaecat non dolore fugiat.
295,372,22,Elit non tempor nulla tempor nostrud esse cupidatat ipsum aliqua sunt esse sunt.
296,334,25,Duis non excepteur officia enim dolore.
297,406,1,Magna exercitation mollit quis ullamco Lorem eiusmod sunt duis ad esse aliqua non deserunt occaecat.
298,26,27,Ea ex laboris pariatur duis tempor anim culpa cillum fugiat velit.
299,258,22,Sit consectetur culpa anim commodo aliqua quis laborum commodo minim in elit magna est.
300,272,28,Deserunt id enim laboris irure sint voluptate nisi aliquip do.
301,8,15,In do excepteur quis minim non reprehenderit deserunt in laborum irure.
302,30,14,Eiusmod Lorem sit aute proident est velit do minim quis.
303,430,13,Cillum consequat aliquip deserunt officia ex id esse in id aute nostrud nisi aliquip veniam.
304,297,8,Qui sunt adipisicing esse mollit reprehenderit minim consequat labore enim reprehenderit minim non ullamco occaecat.
305,472,26,Enim qui cupidatat quis aliquip enim elit eu ad aliqua non.
306,364,29,Quis proident nisi reprehenderit incididunt dolor ex do pariatur ipsum velit.
307,221,17,Nostrud culpa aliquip non do eu et.
308,29,31,Nostrud cupidatat non cupidatat aliquip excepteur aliqua quis.
309,421,3,Sunt Lorem do sint aute duis adipisicing sit anim laboris et duis ad.
310,201,13,Do id reprehenderit voluptate occaecat irure non ea pariatur sint voluptate.
311,132,5,Cupidatat sit consectetur voluptate occaecat eiusmod magna exercitation.
312,169,22,Irure proident dolore ipsum cupidatat est do dolor nostrud sunt Lorem.
313,73,15,Nulla elit quis ex mollit ad eu enim dolore in voluptate.
314,342,27,Minim reprehenderit dolore ullamco ea incididunt nulla in in elit eu id eiusmod sunt nisi.
315,75,7,Ipsum ad fugiat cillum deserunt anim veniam incididunt id labore esse magna.
316,213,19,Occaecat consequat minim voluptate quis.
317,335,2,Aliqua non occaecat aliqua amet magna velit culpa incididunt cupidatat esse dolor magna labore irure.
318,92,14,Voluptate Lorem excepteur aliqua ea deserunt commodo.
319,46,25,In irure occaecat velit consequat laborum eu aliquip exercitation eiusmod.
320,358,9,Dolore occaecat do in sit Lorem nostrud sunt irure adipisicing exercitation Lorem aute sit.
321,477,18,Commodo consequat id adipisicing cupidatat occaecat voluptate velit exercitation eiusmod.
322,203,6,Elit proident eu dolor dolor eiusmod anim amet do.
323,453,21,Culpa mollit mollit cupidatat sint cillum.
324,413,10,Lorem eiusmod enim tempor consectetur.
325,300,28,Minim sint ea voluptate nisi labore anim commodo excepteur est elit consequat est fugiat.
326,322,17,Esse nisi reprehenderit magna ea ex deserunt laborum qui dolor adipisicing officia.
327,291,26,Voluptate veniam dolore consectetur in commodo in et nostrud consectetur duis.
328,209,4,Magna nulla id ea aliquip ex exercitation do.
329,299,4,Veniam et velit nostrud nisi qui nulla.
330,68,5,Culpa ullamco aliquip non pariatur est cillum esse cupidatat dolor aliqua est excepteur.
331,240,27,Minim eu nostrud id incididunt sunt velit occaecat excepteur do eu dolor ad deserunt.
332,301,18,Commodo officia tempor elit aliqua consectetur laborum velit dolore.
