id,post_id,author_id,body
333,120,24,Lorem qui velit veniam nisi adipisicing occaecat incididunt velit anim ea.
334,43,24,Deserunt nisi nostrud dolore do velit officia.
335,456,4,Ullamco officia dolor dolor duis reprehenderit deserunt aliquip.
336,312,14,Adipisicing ad sint aliquip ut pariatur Lorem excepteur.
337,298,5,Eiusmod ad enim Lorem voluptate cillum.
338,261,13,Dolore ad amet deserunt cillum velit dolore cupidatat et.
339,369,6,Aute irure minim duis in.
340,356,16,Nostrud qui excepteur qui velit.
341,134,12,Eu exercitation nisi deserunt officia occaecat nostrud nulla.
342,142,17,Sit aliquip exercitation sint est laboris.
343,3,25,Veniam ea id enim officia veniam excepteur amet aliqua.
344,305,32,Adipisicing labore fugiat irure non.
345,103,7,Minim eu et ea irure voluptate.
346,236,7,Reprehenderit non dolore elit Lorem aliquip non ad ea ea.
347,446,31,Do sunt consequat cillum dolore ipsum eu anim et do ipsum id.
348,123,24,Lorem non sunt deserunt in velit deserunt laboris et commodo.
349,509,26,Eu eiusmod do officia ea excepteur.
350,503,1,Ex id anim elit enim dolor mollit.
351,471,14,Esse commodo est mollit nostrud irure aliquip.
352,115,27,Lorem eiusmod et cupidatat elit aliqua consectetur officia.
353,138,30,Dolore amet proident nisi aliqua nisi laborum excepteur.
354,132,6,Consectetur sint veniam voluptate officia excepteur elit velit consequat aliquip id.
355,157,15,Enim incididunt exercitation culpa dolore non dolor do pariatur quis fugiat ullamco minim.
356,121,5,Eiusmod veniam non mollit labore sunt non nisi cupidatat anim consectetur exercitation eu deserunt.
357,393,4,Excepteur ad veniam pariatur eu mollit ut in Lorem Lorem quis non.
358,230,13,In labore esse culpa est ad sit esse eu irure incididunt magna laborum.
359,506,22,Tempor officia ea elit nostrud ipsum veniam.
360,76,17,Fugiat irure proident laboris eiusmod minim labore enim adipisicing occaecat.
361,69,26,Commodo cupidatat ad elit ullamco dolor sunt sunt sunt ipsum ut.
362,20,2,Qui ullamco adipisicing fugiat veniam minim laboris voluptate veniam ea nostrud labore quis non.
363,241,16,Cillum Lorem proident non ullamco cillum dolore voluptate et non.
364,223,21,Velit nisi laboris ut pariatur sint fugiat enim qui sunt.
365,245,4,Duis anim qui nostrud ullamco officia labore ea enim incididunt dolor veniam eiusmod cupidatat.
366,461,22,Veniam elit irure voluptate sit dolore consectetur minim nostrud ex.
367,46,14,Dolore voluptate Lorem nulla eiusmod exercitation.
368,365,20,Deserunt eu exercitation cillum in consectetur veniam nulla veniam.
369,353,27,Consectetur aliquip duis nulla mollit est eiusmod aliquip officia culpa incididunt eu aute dolore.
370,475,3,Dolore nostrud deserunt voluptate in mollit excepteur culpa eu consectetur do tempor irure.
371,85,4,Ad dolor labore laboris deserunt duis consequat laboris enim exercitation.
372,367,4,Ea eu aute do laborum.
373,495,12,Laborum ea consequat ullamco labore velit quis.
374,293,7,Voluptate nostrud sit veniam dolore aute in occaecat.
375,152,10,Occaecat consequat cupidatat duis labore anim nisi anim et proident non id.
376,35,3,Aliquip ipsum in esse do veniam ipsum minim minim magna duis mollit.
377,288,23,Eiusmod dolore nostrud fugiat dolore.
378,146,11,Cupidatat do do labore mollit est sunt.
379,144,20,Consequat fugiat ipsum irure tempor cillum qui in tempor adipisicing cillum proident est amet.
380,5,16,Et anim cillum amet esse id culpa ut mollit.
381,363,9,Consequat nostrud fugiat dolor proident labore aliquip ut fugiat nisi elit enim non qui.
382,115,32,Do est in in voluptate.
383,58,27,Exercitation amet in proident ullamco do elit aliquip.
384,383,18,Do officia ut reprehenderit officia reprehenderit veniam esse anim aliquip sint cupidatat magna.
385,145,28,Dolor laborum quis sit irure ex culpa nulla fugiat elit deserunt pariatur.
386,357,31,Occaecat irure fugiat ad enim anim veniam ex.
387,61,3,Occaecat id officia sit cillum aliquip qui ut ipsum nisi.
388,169,3,Sint proident sint cillum exercitation officia labore consequat dolore cupidatat ipsum ex.
389,494,22,Cillum laboris duis magna sunt voluptate magna ea fugiat.
390,204,28,Mollit cupidatat amet anim pariatur excepteur irure sunt ex commodo reprehenderit.
391,57,32,Tempor incididunt nostrud veniam id exercitation tempor nostrud cillum ea ex pariatur.
392,489,4,Commodo ullamco est Lorem ea enim ex.
393,97,24,Consectetur mollit do dolore cupidatat labore eiusmod reprehenderit ullamco nulla eu sunt.
394,353,25,Laboris ex quis in id aute pariatur nisi veniam commodo incididunt.
395,458,8,Eiusmod sunt Lorem tempor proident cillum sint aute incididunt laborum eiusmod aliquip adipisicing magna ad.
396,123,21,Adipisicing elit magna voluptate sint reprehenderit reprehenderit nulla incididunt sunt consequat commodo in mollit ex.
397,264,30,Est ea magna duis occaecat aute.
398,257,21,Quis exercitation exercitation eiusmod aute ea veniam veniam enim Lorem reprehenderit.
399,486,17,Officia sunt veniam ea velit Lorem sint anim.
400,90,15,Fugiat nostrud commodo ullamco mollit deserunt et eu eiusmod fugiat.
401,509,12,Ea deserunt veniam nisi ea.
402,311,31,Eu ut fugiat ea consequat fugiat ex Lorem cillum aute dolor.
403,161,12,Veniam exercitation nostrud enim laboris dolor officia laborum id voluptate commodo enim.
404,56,32,Irure incididunt deserunt fugiat non labore ad ut qui irure deserunt qui aliquip enim minim.
405,19,17,Laborum magna qui deserunt labore cillum enim nisi sint eu velit quis ullamco proident anim.
406,423,26,Occaecat fugiat in proident nostrud sint exercitation Lorem pariatur pariatur do magna exercitation quis.
407,486,4,Ipsum aliqua adipisicing anim sunt veniam dolor excepteur consectetur.
408,382,4,Reprehenderit in minim elit ullamco sint mollit esse duis.
409,52,10,Aliqua sunt in cupidatat eu pariatur ullamco commodo sunt eu officia quis nostrud qui.
410,499,23,Veniam irure Lorem qui elit.
411,125,17,Elit irure aliqua ad veniam voluptate.
412,335,28,Duis enim nisi ad voluptate elit.
413,15,4,Sit sunt nostrud magna mollit consequat duis veniam elit ea.
414,83,24,Enim elit incididunt do nisi eu dolor quis minim laboris.
415,296,12,Aliquip elit in non magna proident.
416,220,24,Excepteur id irure tempor eu dolore nulla.
417,277,17,Qui consectetur in cupidatat est quis ullamco enim nostrud aliquip cupidatat occaecat mollit.
418,470,32,Et anim eu dolore deserunt consectetur proident consequat ad.
419,109,20,Eu do consequat excepteur incididunt amet culpa.
420,131,12,Laboris occaecat in occaecat Lorem.
421,404,8,Consectetur cupidatat velit occaecat eu aliquip.
422,97,13,Elit sunt quis mollit sint.
423,481,26,Occaecat qui consequat id ad exercitation ipsum ex irure sunt anim incididunt.
424,168,12,Adipisicing eiusmod deserunt ea aute culpa velit minim.
425,283,24,Do labore velit irure deserunt aute mollit veniam dolore culpa nostrud.
426,503,9,Velit consequat tempor ullamco mollit eu in consectetur amet fugiat tempor id.
427,135,7,Exercitation culpa est voluptate et.
428,499,13,Qui incididunt consequat ad voluptate.
429,2,30,Reprehenderit ad adipisicing sit culpa consectetur proident reprehenderit tempor consectetur.
430,311,14,Laboris labore in minim commodo laborum tempor aliquip sit.
431,373,12,Velit deserunt eiusmod officia et adipisicing nisi laborum cupidatat consectetur ad reprehenderit velit adipisicing.
432,260,8,Laboris aliquip duis ad nostrud et duis nostrud ullamco qui laboris eu nisi proident nostrud.
433,441,9,Ad proident magna nostrud excepteur ipsum fugiat adipisicing consequat anim dolor.
434,305,24,Labore cupidatat pariatur velit deserunt.
435,22,32,Proident pariatur exercitation anim minim ad eiusmod id consectetur quis aute eu laborum.
436,99,28,Nulla magna enim pariatur consectetur adipisicing officia elit amet ullamco anim qui ullamco reprehenderit pariatur.
437,87,32,Id eu officia laboris esse magna aute.
438,204,27,Lorem anim qui labore Lorem proident quis cillum aliqua et fugiat quis laborum labore laboris.
439,230,1,Aliquip Lorem fugiat velit sunt.
440,254,6,Sint excepteur dolor amet tempor id ea labore veniam magna cillum consequat fugiat sit.
441,346,7,Velit amet eu fugiat nostrud sit laboris.
442,98,16,Nostrud sit Lorem magna ea anim mollit elit nostrud.
443,220,30,Labore duis nisi et ullamco est Lorem elit tempor eiusmod id id pariatur veniam.
444,127,27,Dolore deserunt aliquip duis occaecat.
445,293,30,Dolore eiusmod velit in occaecat culpa.
446,174,29,Officia voluptate commodo velit irure nulla nulla aliquip minim Lorem anim commodo anim exercitation excepteur.
447,292,13,Dolor ea reprehenderit qui ut.
448,306,21,Consequat quis magna et veniam do mollit non adipisicing.
449,32,32,Deserunt id consectetur nostrud consectetur voluptate minim do ut sint qui enim incididunt eiusmod nulla.
450,208,14,Eu ut cupidatat mollit Lorem velit eu irure.
451,169,13,Laboris ea consectetur occaecat est ex commodo nostrud et dolore dolor.
452,177,7,Quis adipisicing et et mollit ex consequat veniam id magna aliquip in.
453,244,32,Ad nostrud sit ex laborum anim ad mollit in.
454,74,6,Minim et reprehenderit nisi ex aliqua proident voluptate magna ipsum occaecat exercitation veniam.
455,144,1,Adipisicing nisi esse pariatur incididunt do est commodo qui ex ex commodo minim.
456,505,32,Aliquip aliqua velit non occaecat enim aliquip voluptate aute amet reprehenderit sint nostrud.
457,462,11,Dolore duis deserunt pariatur aliqua magna labore amet ut.
458,310,7,Dolor id reprehenderit dolor ullamco sunt ad ipsum.
459,408,32,Commodo consequat quis sint eiusmod laboris cupidatat.
460,509,20,Qui duis nulla aliquip aliquip nostrud in cillum nostrud mollit laboris in.
461,67,15,Proident magna sit laborum et eiusmod officia esse proident.
462,146,8,Consectetur pariatur veniam ut laboris occaecat nulla ea nulla non.
463,283,22,Ut ea aute nostrud sunt irure do voluptate quis ea veniam adipisicing quis.
464,441,31,Id excepteur voluptate et ut enim occaecat.
465,302,30,Anim dolor deserunt culpa est consequat cupidatat magna anim mollit tempor pariatur exercitation.
466,442,19,Dolore sint aliquip adipisicing labore aliquip reprehenderit minim reprehenderit cillum ex veniam quis duis.
467,395,24,Non ex minim nisi nostrud consectetur aliqua amet nostrud qui proident commodo ea.
468,210,26,Irure ea reprehenderit ea consequat culpa.
469,434,6,Magna ex reprehenderit nisi voluptate esse esse dolore excepteur pariatur pariatur consectetur veniam anim do.
470,111,6,Lorem sunt deserunt et qui adipisicing laborum in Lorem ea.
471,263,19,Nulla occaecat aute id sint.
472,395,24,Pariatur ex dolore veniam non mollit in eu tempor dolore tempor.
473,99,29,Fugiat deserunt do irure et velit nisi consequat.
474,305,12,Cupidatat laboris consequat voluptate aute qui mollit aute dolor mollit elit.
475,476,18,Proident proident laboris anim id pariatur velit magna ullamco sunt anim enim sint pariatur.
476,167,32,Mollit laboris proident in veniam.
477,280,31,In eu velit do excepteur id tempor do ea.
478,303,21,Eiusmod laboris commodo exercitation Lorem ipsum labore ex fugiat.
479,333,23,Duis reprehenderit ea laborum tempor nulla nisi laboris fugiat laboris reprehenderit irure dolor.
480,36,31,Dolor adipisicing elit deserunt ex veniam.
481,99,25,Amet non voluptate excepteur culpa pariatur irure aute tempor.
482,177,8,Velit aute sunt ullamco velit anim ea proident veniam aute nulla.
483,372,3,Aliqua sit nostrud laborum aute non minim nisi anim sit tempor nulla aliqua.
484,346,2,Velit esse velit reprehenderit ex nulla pariatur eu.
485,20,22,Nisi ad voluptate id dolore voluptate deserunt incididunt aliqua est mollit aliquip incididunt.
486,94,2,Enim anim incididunt magna nulla deserunt labore aute enim nostrud eu cupidatat ex amet.
487,186,12,Non ipsum adipisicing dolore ad incididunt elit occaecat ex consectetur minim sit.
488,375,19,Est mollit eu mollit aliqua occaecat.
489,224,3,Laborum incididunt consequat incididunt ea aute duis ea ea adipisicing est duis irure nisi occaecat.
490,318,14,Velit adipisicing nulla nostrud voluptate non in voluptate enim ex elit ipsum aliqua Lorem exercitation.
491,482,25,Ea sint velit ea aliquip anim aliquip commodo proident sunt enim aliqua consequat.
492,124,23,Non incididunt do veniam et proident ipsum non excepteur esse ad mollit incididunt.
493,396,20,Velit occaecat in mollit do amet.
494,89,16,Ut veniam enim minim occaecat cupidatat laboris.
495,114,24,Consequat sunt laborum tempor magna elit sint reprehenderit quis voluptate qui aliqua amet dolore.
496,273,18,Pariatur aute Lorem do dolor enim nulla ea non dolor et.
497,485,26,Culpa ullamco ut sit amet id.
498,307,12,Occaecat nostrud dolore consequat est aliqua ad exercitation elit velit qui commodo ut.
499,29,25,Laborum laboris culpa enim laborum laborum velit qui amet culpa.
500,16,32,Sit elit culpa est enim exercitation sint sit voluptate laborum.
501,47,22,Sint occaecat ex minim eu aliquip mollit.
502,355,12,Amet laboris adipisicing et officia sint sint Lorem anim aliquip id et.
503,107,28,Sunt laborum dolor irure in cillum ex elit anim.
504,237,29,Consectetur sunt Lorem pariatur nostrud.
505,383,31,Minim dolor nulla cillum veniam non non ea magna in commodo et eiusmod exercitation cillum.
506,442,24,Sunt amet in incididunt dolore sint consectetur sint dolore velit incididunt velit culpa aliqua.
507,307,5,Sit tempor est enim deserunt non ex aute officia deserunt eiusmod.
508,244,14,Lorem enim cillum aliqua deserunt proident laborum amet exercitation eiusmod mollit quis.
509,219,27,Irure proident esse irure incididunt officia enim adipisicing officia magna ullamco id.
510,512,7,Cillum dolor nulla mollit aliquip do duis id do officia.
511,325,30,In cillum sint laboris dolor do.
512,108,25,Anim eiusmod dolore occaecat cillum cillum ut fugiat.